{
  "lang": "en",
  "pages": [
    {
      "id": "home",
      "file": "index.html",
      "nav": "Home"
    },
    {
      "id": "menu",
      "file": "menu.html",
      "nav": "Menu"
    },
    {
      "id": "story",
      "file": "our-story.html",
      "nav": "Our story"
    },
    {
      "id": "visit",
      "file": "visit-us.html",
      "nav": "Visit us"
    },
    {
      "id": "order",
      "file": "order-online.html",
      "nav": "Order online",
      "cta": true
    }
  ],
  "demo": {
    "bar": "Fictional restaurant — a concept design by Simplified Tech Solutions. Menu, prices, address and hours are samples.",
    "barShort": "Fictional restaurant. STS design concept.",
    "footer": "Jade & Ember is a fictional restaurant created by Simplified Tech Solutions as a website design concept. It does not exist. All menu items, prices, the address, the phone number and the opening hours are invented samples. Food imagery and the hero video are AI-generated concept media and do not depict real dishes served by any restaurant.",
    "backLabel": "Back to the STS showcase",
    "backShort": "STS showcase",
    "backHref": "../",
    "titleSuffix": " (fictional concept by STS)",
    "stamp": "Concept v0.7: five pages. Hero loop on desktop widths only (concept footage)."
  },
  "credit": {
    "label": "Website concept by Simplified Tech Solutions",
    "href": "https://getsimplifiedtech.com/"
  }
}
